{
  "behavioral_basis": [
    {
      "description": "Pre-registered upstream evidence location; reproduction is pending.",
      "kind": "upstream_tests",
      "location": "test/rr_arb_tree_tb.sv"
    }
  ],
  "categories": [
    "selection_arbitration",
    "state_control_queue"
  ],
  "compile_context": {
    "black_boxes": [],
    "build_commands": [],
    "clocks": [
      {
        "edge": "rising",
        "name": "clk_i",
        "period_ns": null
      }
    ],
    "defines": [
      "SYNTHESIS"
    ],
    "filelist": null,
    "frontend": null,
    "frontend_version": null,
    "generated_inputs": [],
    "include_dirs": [
      "include"
    ],
    "lint_commands": [],
    "memories": [],
    "parameters": {
      "NumIn": 4
    },
    "resets": [
      {
        "name": "rst_ni",
        "polarity": "active_low",
        "synchronous": false
      }
    ],
    "sources": [
      "src/cf_math_pkg.sv",
      "src/lzc.sv",
      "src/rr_arb_tree.sv"
    ],
    "test_commands": [],
    "top": "rr_arb_tree"
  },
  "compile_context_hashes": {
    "compile_context_hash": "26f0e83e1a8891ecd96e1f9407ccc16b330e03f7b33f262021cd800ed2fba434",
    "filelist_sha256": null,
    "generated_input_hashes": [],
    "include_tree_hashes": [
      {
        "path": "include",
        "sha256": "ff612d5da4c2ed1d69a99729d3ffb78939bd609c9a600e64306dce3f817e5cc5"
      }
    ]
  },
  "display_name": "PULP common_cells rr_arb_tree",
  "document_type": "rtl-advisor.reference-manifest",
  "lineage": {
    "containing_design_ids": [
      "pulp-common-cells"
    ],
    "design_lineage_id": "pulp-common-cells-rr-arb-tree",
    "repository_lineage_id": "pulp-common-cells",
    "upstream_project_id": "pulp-common-cells"
  },
  "proof_contract": {
    "assumptions": [
      "Reset and protocol assumptions will be frozen before proof."
    ],
    "kind": "cycle_aligned_sequential_equivalence",
    "latency_relation": "same_cycle",
    "level": "P2",
    "observables": [
      "all top-level outputs"
    ],
    "schema": "rtl-advisor-proof-v1"
  },
  "provenance": {
    "canonical_url": "https://github.com/pulp-platform/common_cells",
    "license": {
      "disposition": "conditional",
      "expression": "SHL-0.51 OR Apache-2.0",
      "sha256": "6527a46225891b976fa94f634f6ee0cd22e1c7129d6f11c5c98c997627625fc7",
      "url": "https://github.com/pulp-platform/common_cells/blob/1281545696eb3fcba50ec5b4275993476a3c710e/LICENSE"
    },
    "project": "pulp-common-cells",
    "revision": "1281545696eb3fcba50ec5b4275993476a3c710e",
    "revision_kind": "commit"
  },
  "qualification": {
    "reason": "Compile-context reproduction failed at: build",
    "state": "source_pinned",
    "status": "blocked"
  },
  "reference_id": "pulp-common-cells-rr-arb-tree",
  "schema": "rtl-advisor-reference-v1",
  "schema_version": 1,
  "semantic_hash": "70a311787353bb0f1ca926c5c2bf29d62f37523e6519be073321f025a035e787",
  "source_hashes": [
    {
      "path": "src/cf_math_pkg.sv",
      "sha256": "bbf0614771ceb9526356bb8e5234787324ef215884bc11b4aa27e91fc3cc8910"
    },
    {
      "path": "src/lzc.sv",
      "sha256": "f31989be4369ea7c4809c0c3d61df28581e9ac7666005fde6e476a975d1acd07"
    },
    {
      "path": "src/rr_arb_tree.sv",
      "sha256": "f72bc188ea8253230a722bfb6436ab31b6e41c26020fa4ba4eebd93025984f7e"
    }
  ],
  "split": "development",
  "synthesis_profiles": [
    "standard",
    "stronger"
  ],
  "tier": "A"
}
