{
  "behavioral_basis": [
    {
      "description": "Pre-registered upstream evidence location; reproduction is pending.",
      "kind": "upstream_tests",
      "location": "test/stream_register_tb.sv"
    }
  ],
  "categories": [
    "buffering_flow_control",
    "pipeline_register_placement"
  ],
  "compile_context": {
    "black_boxes": [],
    "build_commands": [],
    "clocks": [
      {
        "edge": "rising",
        "name": "clk_i",
        "period_ns": null
      }
    ],
    "defines": [
      "SYNTHESIS"
    ],
    "filelist": null,
    "frontend": null,
    "frontend_version": null,
    "generated_inputs": [],
    "include_dirs": [
      "include"
    ],
    "lint_commands": [],
    "memories": [],
    "parameters": {},
    "resets": [
      {
        "name": "rst_ni",
        "polarity": "active_low",
        "synchronous": false
      }
    ],
    "sources": [
      "src/stream_register.sv"
    ],
    "test_commands": [],
    "top": "stream_register"
  },
  "compile_context_hashes": {
    "compile_context_hash": "863b20bb393e3d53ef6bad3a5ddf07d3cd8f8d556c3dafd41d8abc67392baca2",
    "filelist_sha256": null,
    "generated_input_hashes": [],
    "include_tree_hashes": [
      {
        "path": "include",
        "sha256": "ff612d5da4c2ed1d69a99729d3ffb78939bd609c9a600e64306dce3f817e5cc5"
      }
    ]
  },
  "display_name": "PULP common_cells stream_register",
  "document_type": "rtl-advisor.reference-manifest",
  "lineage": {
    "containing_design_ids": [
      "pulp-common-cells"
    ],
    "design_lineage_id": "pulp-common-cells-stream-register",
    "repository_lineage_id": "pulp-common-cells",
    "upstream_project_id": "pulp-common-cells"
  },
  "proof_contract": {
    "assumptions": [
      "Reset and protocol assumptions will be frozen before proof."
    ],
    "kind": "cycle_aligned_sequential_equivalence",
    "latency_relation": "same_cycle",
    "level": "P2",
    "observables": [
      "all top-level outputs"
    ],
    "schema": "rtl-advisor-proof-v1"
  },
  "provenance": {
    "canonical_url": "https://github.com/pulp-platform/common_cells",
    "license": {
      "disposition": "conditional",
      "expression": "SHL-0.51 OR Apache-2.0",
      "sha256": "6527a46225891b976fa94f634f6ee0cd22e1c7129d6f11c5c98c997627625fc7",
      "url": "https://github.com/pulp-platform/common_cells/blob/1281545696eb3fcba50ec5b4275993476a3c710e/LICENSE"
    },
    "project": "pulp-common-cells",
    "revision": "1281545696eb3fcba50ec5b4275993476a3c710e",
    "revision_kind": "commit"
  },
  "qualification": {
    "reason": null,
    "state": "source_pinned",
    "status": "active"
  },
  "reference_id": "pulp-common-cells-stream-register",
  "schema": "rtl-advisor-reference-v1",
  "schema_version": 1,
  "semantic_hash": "14b77df6330ce1c4fd62cab0cee6617d446891721e18bc5eca2ec90c6839ab2c",
  "source_hashes": [
    {
      "path": "src/stream_register.sv",
      "sha256": "2e0e5b6d09ce4ade0881938ee042dcbc78438638fa2592338a374f88a3c27304"
    }
  ],
  "split": "development",
  "synthesis_profiles": [
    "standard",
    "stronger"
  ],
  "tier": "A"
}
