{
  "behavioral_basis": [
    {
      "description": "Bounded FIFO property proof checks ordered payload delivery, occupancy safety, no extra outputs, and bounded drain. Evidence hash: 5f935a414f50b677a47cd80ba0f53165fd26af181630d6ab4a43017cdfcb0084.",
      "kind": "assertions",
      "location": "artifacts/corpus-behavior/wave2-tier-a-12-v1/2a8ffc172c406c0e9482feef28372204409041e2fe3532475a778a6ae400a4b7/pulp-common-cells-fifo-v3/result.json"
    }
  ],
  "categories": [
    "buffering_flow_control",
    "state_control_queue"
  ],
  "compile_context": {
    "black_boxes": [],
    "build_commands": [
      "yosys -m /opt/oss-cad-suite/share/yosys/plugins/slang.so -Q -p 'read_slang --top fifo_v3 -D SYNTHESIS -I corpus/upstream/common_cells/include corpus/upstream/common_cells/src/fifo_v3.sv; hierarchy -check -top fifo_v3; proc; check'"
    ],
    "clocks": [
      {
        "edge": "rising",
        "name": "clk_i",
        "period_ns": null
      }
    ],
    "defines": [
      "SYNTHESIS"
    ],
    "filelist": null,
    "frontend": "verilator+yosys-slang",
    "frontend_version": "Verilator 5.047 devel rev v5.046-58-gb89d29cab (mod); Yosys 0.63+49 (git sha1 95d738edc, clang++ 18.1.8 -fPIC -O3)",
    "generated_inputs": [],
    "include_dirs": [
      "include"
    ],
    "lint_commands": [
      "verilator --lint-only --language 1800-2017 --Wall --Wno-fatal -DSYNTHESIS -Icorpus/upstream/common_cells/include --top-module fifo_v3 corpus/upstream/common_cells/src/fifo_v3.sv"
    ],
    "memories": [],
    "parameters": {},
    "resets": [
      {
        "name": "rst_ni",
        "polarity": "active_low",
        "synchronous": false
      }
    ],
    "sources": [
      "src/fifo_v3.sv"
    ],
    "test_commands": [],
    "top": "fifo_v3"
  },
  "compile_context_hashes": {
    "compile_context_hash": "425f4ab58c4325eb53ef834e881352ebc4d7bb1385f158af8d34fe778a9f62ed",
    "filelist_sha256": null,
    "generated_input_hashes": [],
    "include_tree_hashes": [
      {
        "path": "include",
        "sha256": "ff612d5da4c2ed1d69a99729d3ffb78939bd609c9a600e64306dce3f817e5cc5"
      }
    ]
  },
  "display_name": "PULP common_cells fifo_v3",
  "document_type": "rtl-advisor.reference-manifest",
  "lineage": {
    "containing_design_ids": [
      "pulp-common-cells"
    ],
    "design_lineage_id": "pulp-common-cells-fifo-v3",
    "repository_lineage_id": "pulp-common-cells",
    "upstream_project_id": "pulp-common-cells"
  },
  "proof_contract": {
    "assumptions": [
      "Reset and protocol assumptions will be frozen before proof."
    ],
    "kind": "cycle_aligned_sequential_equivalence",
    "latency_relation": "same_cycle",
    "level": "P2",
    "observables": [
      "all top-level outputs"
    ],
    "schema": "rtl-advisor-proof-v1"
  },
  "provenance": {
    "canonical_url": "https://github.com/pulp-platform/common_cells",
    "license": {
      "disposition": "conditional",
      "expression": "SHL-0.51 OR Apache-2.0",
      "sha256": "6527a46225891b976fa94f634f6ee0cd22e1c7129d6f11c5c98c997627625fc7",
      "url": "https://github.com/pulp-platform/common_cells/blob/1281545696eb3fcba50ec5b4275993476a3c710e/LICENSE"
    },
    "project": "pulp-common-cells",
    "revision": "1281545696eb3fcba50ec5b4275993476a3c710e",
    "revision_kind": "commit"
  },
  "qualification": {
    "reason": null,
    "state": "behavior_baselined",
    "status": "active"
  },
  "reference_id": "pulp-common-cells-fifo-v3",
  "schema": "rtl-advisor-reference-v1",
  "schema_version": 1,
  "semantic_hash": "f4870dbb4b79763fa6ec9b297743d07d53a8129f6dc11a89c248867bb4e7c00d",
  "source_hashes": [
    {
      "path": "src/fifo_v3.sv",
      "sha256": "861ea44cbd3129731b77977da36fb0dac1a1350d7df664a1b4310423e7d272bc"
    }
  ],
  "split": "development",
  "synthesis_profiles": [
    "standard",
    "stronger"
  ],
  "tier": "A"
}
