{
  "behavioral_basis": [
    {
      "description": "Pinned upstream cocotb regression covers pipeline traffic, backpressure, reset behavior, and sideband handling. Evidence hash: 2eb6ad89bfb75ae9324d57be17aaff6e0c48585cbabf6ae6b81fe7981587e5f4.",
      "kind": "upstream_tests",
      "location": "artifacts/corpus-behavior/wave2-tier-a-12-v1/2a8ffc172c406c0e9482feef28372204409041e2fe3532475a778a6ae400a4b7/verilog-axis-axis-pipeline-register/result.json"
    },
    {
      "description": "Hash-matched P3 proof establishes ordered-transaction equivalence between one-stage simple and two-stage skid configurations under bounded backpressure. Evidence hash: 2eb6ad89bfb75ae9324d57be17aaff6e0c48585cbabf6ae6b81fe7981587e5f4.",
      "kind": "documented_pair",
      "location": "artifacts/corpus-behavior/wave2-tier-a-12-v1/2a8ffc172c406c0e9482feef28372204409041e2fe3532475a778a6ae400a4b7/verilog-axis-axis-pipeline-register/result.json"
    }
  ],
  "categories": [
    "buffering_flow_control",
    "pipeline_register_placement"
  ],
  "compile_context": {
    "black_boxes": [],
    "build_commands": [
      "yosys -m /opt/oss-cad-suite/share/yosys/plugins/slang.so -Q -p 'read_slang --top axis_pipeline_register corpus/upstream/verilog-axis/rtl/axis_pipeline_register.v corpus/upstream/verilog-axis/rtl/axis_register.v; hierarchy -check -top axis_pipeline_register; proc; check'"
    ],
    "clocks": [
      {
        "edge": "rising",
        "name": "clk",
        "period_ns": null
      }
    ],
    "defines": [],
    "filelist": null,
    "frontend": "verilator+yosys-slang",
    "frontend_version": "Verilator 5.047 devel rev v5.046-58-gb89d29cab (mod); Yosys 0.63+49 (git sha1 95d738edc, clang++ 18.1.8 -fPIC -O3)",
    "generated_inputs": [],
    "include_dirs": [],
    "lint_commands": [
      "verilator --lint-only --language 1800-2017 --Wall --Wno-fatal --top-module axis_pipeline_register corpus/upstream/verilog-axis/rtl/axis_pipeline_register.v corpus/upstream/verilog-axis/rtl/axis_register.v"
    ],
    "memories": [],
    "parameters": {},
    "resets": [
      {
        "name": "rst",
        "polarity": "active_high",
        "synchronous": true
      }
    ],
    "sources": [
      "rtl/axis_pipeline_register.v",
      "rtl/axis_register.v"
    ],
    "test_commands": [],
    "top": "axis_pipeline_register"
  },
  "compile_context_hashes": {
    "compile_context_hash": "f0a2a0374a4dc2d981112dbb9fa77f3ca5ac5c164a90076a79a6a2ac8a11a03a",
    "filelist_sha256": null,
    "generated_input_hashes": [],
    "include_tree_hashes": []
  },
  "display_name": "verilog-axis axis_pipeline_register",
  "document_type": "rtl-advisor.reference-manifest",
  "lineage": {
    "containing_design_ids": [
      "alexforencich-verilog-axis"
    ],
    "design_lineage_id": "verilog-axis-axis-pipeline-register",
    "repository_lineage_id": "alexforencich-verilog-axis",
    "upstream_project_id": "alexforencich-verilog-axis"
  },
  "proof_contract": {
    "assumptions": [
      "Reset and protocol assumptions will be frozen before proof."
    ],
    "kind": "cycle_aligned_sequential_equivalence",
    "latency_relation": "same_cycle",
    "level": "P2",
    "observables": [
      "all top-level outputs"
    ],
    "schema": "rtl-advisor-proof-v1"
  },
  "provenance": {
    "canonical_url": "https://github.com/alexforencich/verilog-axis",
    "license": {
      "disposition": "conditional",
      "expression": "MIT",
      "sha256": "8ea57f95365e9b16a5b516f422b71269183a1ae53bab5878ae6d69039e58fe77",
      "url": "https://github.com/alexforencich/verilog-axis/blob/48ff7a7e2ef782cf778d47910cf85835c64b1bce/COPYING"
    },
    "project": "alexforencich-verilog-axis",
    "revision": "48ff7a7e2ef782cf778d47910cf85835c64b1bce",
    "revision_kind": "commit"
  },
  "qualification": {
    "reason": null,
    "state": "behavior_baselined",
    "status": "active"
  },
  "reference_id": "verilog-axis-axis-pipeline-register",
  "schema": "rtl-advisor-reference-v1",
  "schema_version": 1,
  "semantic_hash": "1e279037ddf8a4c42dca3b1ff84b096879f5cef3caa1f43101908e8bf45a4fea",
  "source_hashes": [
    {
      "path": "rtl/axis_pipeline_register.v",
      "sha256": "89bcac460e3822dbbed3f2dbd4d9902faac1262d9dcad867b39c97a6f4402fcc"
    },
    {
      "path": "rtl/axis_register.v",
      "sha256": "599fde2d6c2d806643bbffb7c444297e69a71871f962d4b741ec1914342e0d39"
    }
  ],
  "split": "development",
  "synthesis_profiles": [
    "standard",
    "stronger"
  ],
  "tier": "A"
}
