{
  "schema_version": 1,
  "schema": "rtl-advisor-reference-v1",
  "document_type": "rtl-advisor.reference-manifest",
  "reference_id": "opentitan-prim-arbiter-ppc",
  "display_name": "OpenTitan prim_arbiter_ppc discovery reference",
  "tier": "A",
  "categories": [
    "selection_arbitration"
  ],
  "qualification": {
    "state": "discovered",
    "status": "active",
    "reason": null
  },
  "provenance": {
    "project": "OpenTitan",
    "canonical_url": "https://github.com/lowRISC/opentitan",
    "revision": null,
    "revision_kind": "unresolved",
    "license": {
      "expression": "Apache-2.0",
      "url": "https://github.com/lowRISC/opentitan/blob/master/LICENSE",
      "sha256": null,
      "disposition": "pending"
    }
  },
  "lineage": {
    "upstream_project_id": "lowrisc-opentitan",
    "repository_lineage_id": "github.com-lowrisc-opentitan",
    "design_lineage_id": "lowrisc-opentitan-prim-arbiter",
    "containing_design_ids": [
      "lowrisc-opentitan-soc"
    ]
  },
  "compile_context": {
    "top": "prim_arbiter_ppc",
    "sources": [
      "hw/ip/prim/rtl/prim_arbiter_ppc.sv"
    ],
    "filelist": null,
    "include_dirs": [],
    "defines": [],
    "parameters": {
      "N": 4
    },
    "generated_inputs": [],
    "clocks": [
      {
        "name": "clk_i",
        "edge": "rising",
        "period_ns": null
      }
    ],
    "resets": [
      {
        "name": "rst_ni",
        "polarity": "active_low",
        "synchronous": false
      }
    ],
    "memories": [],
    "black_boxes": [],
    "frontend": null,
    "frontend_version": null,
    "build_commands": [],
    "lint_commands": [],
    "test_commands": []
  },
  "compile_context_hashes": {
    "filelist_sha256": null,
    "include_tree_hashes": [],
    "generated_input_hashes": [],
    "compile_context_hash": null
  },
  "behavioral_basis": [
    {
      "kind": "documented_pair",
      "location": "https://github.com/lowRISC/opentitan/blob/master/hw/ip/prim/rtl/prim_arbiter_tree.sv",
      "description": "Upstream documents the tree implementation as behaviorally matching the PPC implementation while targeting a shorter critical path."
    }
  ],
  "proof_contract": {
    "schema": "rtl-advisor-proof-v1",
    "level": "P2",
    "kind": "cycle_aligned_sequential_equivalence",
    "latency_relation": "same_cycle",
    "assumptions": [
      "Requests obey the upstream locking and stability contract",
      "Both implementations use identical parameters and reset semantics"
    ],
    "observables": [
      "grant outputs",
      "lock-visible arbitration state"
    ]
  },
  "source_hashes": [],
  "synthesis_profiles": [
    "standard",
    "stronger"
  ],
  "split": "unassigned"
}
