{
  "behavioral_basis": [
    {
      "description": "Pre-registered upstream evidence location; reproduction is pending.",
      "kind": "specification",
      "location": "Bender.yml"
    }
  ],
  "categories": [
    "selection_arbitration",
    "bus_adapter_interconnect"
  ],
  "compile_context": {
    "black_boxes": [],
    "build_commands": [],
    "clocks": [],
    "defines": [],
    "filelist": null,
    "frontend": null,
    "frontend_version": null,
    "generated_inputs": [],
    "include_dirs": [],
    "lint_commands": [],
    "memories": [],
    "parameters": {},
    "resets": [],
    "sources": [
      "src/stream_mux.sv"
    ],
    "test_commands": [],
    "top": "stream_mux"
  },
  "compile_context_hashes": {
    "compile_context_hash": null,
    "filelist_sha256": null,
    "generated_input_hashes": [],
    "include_tree_hashes": []
  },
  "display_name": "PULP common_cells stream_mux",
  "document_type": "rtl-advisor.reference-manifest",
  "lineage": {
    "containing_design_ids": [
      "pulp-common-cells"
    ],
    "design_lineage_id": "pulp-common-cells-stream-mux",
    "repository_lineage_id": "pulp-common-cells",
    "upstream_project_id": "pulp-common-cells"
  },
  "proof_contract": {
    "assumptions": [],
    "kind": "combinational_equivalence",
    "latency_relation": "combinational",
    "level": "P1",
    "observables": [
      "all top-level outputs"
    ],
    "schema": "rtl-advisor-proof-v1"
  },
  "provenance": {
    "canonical_url": "https://github.com/pulp-platform/common_cells",
    "license": {
      "disposition": "conditional",
      "expression": "SHL-0.51 OR Apache-2.0",
      "sha256": "6527a46225891b976fa94f634f6ee0cd22e1c7129d6f11c5c98c997627625fc7",
      "url": "https://github.com/pulp-platform/common_cells/blob/1281545696eb3fcba50ec5b4275993476a3c710e/LICENSE"
    },
    "project": "pulp-common-cells",
    "revision": "1281545696eb3fcba50ec5b4275993476a3c710e",
    "revision_kind": "commit"
  },
  "qualification": {
    "reason": null,
    "state": "license_reviewed",
    "status": "active"
  },
  "reference_id": "pulp-common-cells-stream-mux",
  "schema": "rtl-advisor-reference-v1",
  "schema_version": 1,
  "semantic_hash": "1ef886d1ecac56184e6498eb1a368679f36b8e1a7e986857ca4d2e86f6d64a99",
  "source_hashes": [
    {
      "path": "src/stream_mux.sv",
      "sha256": "865fe908c738eb54ad1721666d877a1cccb698f975fbd3385f71b948426d245f"
    }
  ],
  "split": "development",
  "synthesis_profiles": [
    "standard",
    "stronger"
  ],
  "tier": "A"
}
